{
  "format": "renard-etudiant/lecons",
  "version": 2,
  "generation": {
    "assiste_par_ia": true,
    "outil": "Claude Opus 5.5",
    "date": "2026-10-05"
  },
  "parcours": {
    "slug": "design-patterns-en-python",
    "titre": "Design patterns en Python pour les API critiques",
    "description": "Les patrons de conception qu'utilisent les équipes des banques et des plateformes de données : Stratégie, Fabrique, Adaptateur, Décorateur, Observateur, Dépôt, Unité de travail, réessai, disjoncteur, limiteur de débit, idempotence, cache, saga et event sourcing. Prérequis : savoir écrire des fonctions et des classes en Python.",
    "niveau": "intermediaire",
    "theme": "python",
    "lecons": [
      "design-patterns-introduction",
      "patron-strategie",
      "patron-fabrique",
      "patron-adaptateur",
      "patron-decorateur",
      "patron-observateur",
      "patron-depot",
      "patron-unite-de-travail",
      "patron-reessai-backoff",
      "patron-disjoncteur",
      "patron-limiteur-de-debit",
      "patron-cle-idempotence",
      "patron-cache-aside",
      "patron-saga",
      "patron-event-sourcing",
      "design-patterns-api-de-paiement"
    ]
  },
  "lecons": [
    {
      "slug": "design-patterns-introduction",
      "titre": "Les design patterns, à quoi ça sert ?",
      "resume": "Comprendre ce qu'est un design pattern et pourquoi les API critiques (banque, paiement, big data) en dépendent.",
      "theme": "python",
      "niveau": "intermediaire",
      "duree_minutes": 13,
      "prerequis": [],
      "objectifs": [
        "Expliquer ce qu'est un design pattern",
        "Décrire un contrat avec typing.Protocol",
        "Manipuler des montants avec Decimal plutôt qu'avec float"
      ],
      "blocs": [
        {
          "type": "texte",
          "markdown": "Un **design pattern** (en français, *patron de conception*) est une solution éprouvée à un problème qui revient souvent. Ce n'est pas une bibliothèque à installer : c'est un **plan**, que tu adaptes à ton code.\n\nDans une API soumise à une forte charge, comme celle d'une banque ou d'une plateforme de données, trois questions reviennent sans cesse :\n\n- **Évoluer** : ajouter un moyen de paiement sans tout réécrire.\n- **Résister** : continuer à répondre quand un service voisin tombe en panne.\n- **Rester juste** : ne jamais débiter deux fois, ne jamais perdre un centime.\n\nCe parcours te donne, pour chaque question, les patrons que les équipes utilisent vraiment."
        },
        {
          "type": "texte",
          "markdown": "## Programmer pour un contrat\n\nPresque tous les patrons reposent sur la même idée : ton code dépend d'un **contrat** (ce qu'un objet sait faire), pas d'une classe précise.\n\nEn Python, on écrit ce contrat avec `Protocol`, du module `typing`. Une classe le respecte dès qu'elle a les bonnes méthodes : pas besoin d'hériter de quoi que ce soit."
        },
        {
          "type": "code",
          "langage": "python",
          "code": "from typing import Protocol\n\n\nclass Notifieur(Protocol):\n    def envoyer(self, message: str) -> None: ...\n\n\nclass NotifieurEmail:\n    def envoyer(self, message: str) -> None:\n        print(f\"[email] {message}\")\n\n\nclass NotifieurSms:\n    def envoyer(self, message: str) -> None:\n        print(f\"[sms] {message}\")\n\n\ndef alerter_client(notifieur: Notifieur, montant: str) -> None:\n    notifieur.envoyer(f\"Paiement de {montant} € accepté\")\n\n\nalerter_client(NotifieurEmail(), \"42,00\")\nalerter_client(NotifieurSms(), \"42,00\")\n",
          "executable": true,
          "sortie_attendue": "[email] Paiement de 42,00 € accepté\n[sms] Paiement de 42,00 € accepté\n"
        },
        {
          "type": "texte",
          "markdown": "`alerter_client` ne sait pas comment le message part. Demain, tu peux ajouter un `NotifieurPush` sans toucher à cette fonction."
        },
        {
          "type": "texte",
          "markdown": "## L'argent ne se compte pas en float\n\nUn `float` est un nombre à virgule stocké en binaire. Il est rapide, mais approximatif. Pour de l'argent, on utilise `Decimal`, qui calcule en base 10, exactement comme sur un relevé bancaire."
        },
        {
          "type": "code",
          "langage": "python",
          "code": "from decimal import Decimal\n\nprint(0.1 + 0.2)\nprint(Decimal(\"0.10\") + Decimal(\"0.20\"))\n",
          "executable": true,
          "sortie_attendue": "0.30000000000000004\n0.30\n"
        },
        {
          "type": "encadre",
          "variante": "attention",
          "markdown": "Crée toujours un `Decimal` à partir d'une **chaîne** : `Decimal(\"0.10\")`. Écrire `Decimal(0.1)` recopie l'erreur du `float`."
        },
        {
          "type": "exercice",
          "langage": "python",
          "consigne": "Écris une classe `NotifieurSlack` qui respecte le contrat `Notifieur` : sa méthode `envoyer` affiche `[slack] ` suivi du message.\n\nDécommente ensuite la dernière ligne. `alerter_client` ne doit pas changer.",
          "code": "from typing import Protocol\n\n\nclass Notifieur(Protocol):\n    def envoyer(self, message: str) -> None: ...\n\n\ndef alerter_client(notifieur: Notifieur, montant: str) -> None:\n    notifieur.envoyer(f\"Paiement de {montant} € accepté\")\n\n\nclass NotifieurSlack:\n    pass  # À compléter\n\n\n# alerter_client(NotifieurSlack(), \"42,00\")\n",
          "solution": "from typing import Protocol\n\n\nclass Notifieur(Protocol):\n    def envoyer(self, message: str) -> None: ...\n\n\ndef alerter_client(notifieur: Notifieur, montant: str) -> None:\n    notifieur.envoyer(f\"Paiement de {montant} € accepté\")\n\n\nclass NotifieurSlack:\n    def envoyer(self, message: str) -> None:\n        print(f\"[slack] {message}\")\n\n\nalerter_client(NotifieurSlack(), \"42,00\")\n",
          "sortie_attendue": "[slack] Paiement de 42,00 € accepté\n"
        },
        {
          "type": "encadre",
          "variante": "a_retenir",
          "markdown": "- Un design pattern est une solution type, pas un morceau de code à copier.\n- Dépends d'un contrat (`Protocol`), pas d'une classe.\n- Un patron ajoute de la complexité : utilise-le seulement quand le problème qu'il résout existe vraiment."
        }
      ],
      "sources": [
        {
          "titre": "Documentation Python : typing.Protocol",
          "url": "https://docs.python.org/fr/3/library/typing.html#typing.Protocol"
        },
        {
          "titre": "Documentation Python : decimal",
          "url": "https://docs.python.org/fr/3/library/decimal.html"
        }
      ]
    },
    {
      "slug": "patron-strategie",
      "titre": "Stratégie : changer de règle sans changer le code",
      "resume": "Remplacer une cascade de if par des stratégies interchangeables, par exemple pour calculer des frais bancaires.",
      "theme": "python",
      "niveau": "intermediaire",
      "duree_minutes": 13,
      "prerequis": [
        "design-patterns-introduction"
      ],
      "objectifs": [
        "Reconnaître une cascade de conditions à remplacer",
        "Écrire plusieurs stratégies qui respectent le même contrat",
        "Choisir une stratégie à partir d'un dictionnaire"
      ],
      "blocs": [
        {
          "type": "texte",
          "markdown": "Une banque calcule des frais de virement différents selon le type de compte. Le premier réflexe est une cascade de `if` :"
        },
        {
          "type": "code",
          "langage": "python",
          "code": "def frais_virement(type_compte, montant):\n    if type_compte == \"standard\":\n        return montant * Decimal(\"0.02\")\n    elif type_compte == \"premium\":\n        return Decimal(\"0.00\")\n    elif type_compte == \"pro\":\n        ...\n    # Chaque nouvelle offre commerciale ajoute un elif ici.\n",
          "executable": false
        },
        {
          "type": "texte",
          "markdown": "Cette fonction grossit à chaque nouvelle offre, et chaque modification risque de casser les autres règles.\n\nLe patron **Stratégie** range chaque règle dans son propre objet. Toutes respectent le même contrat : une méthode `calculer`. Le code appelant choisit la bonne stratégie, puis l'utilise sans savoir laquelle c'est."
        },
        {
          "type": "code",
          "langage": "python",
          "code": "from decimal import Decimal, ROUND_HALF_UP\nfrom typing import Protocol\n\nCENTIME = Decimal(\"0.01\")\n\n\nclass StrategieFrais(Protocol):\n    def calculer(self, montant: Decimal) -> Decimal: ...\n\n\nclass FraisStandard:\n    def calculer(self, montant: Decimal) -> Decimal:\n        return (montant * Decimal(\"0.02\")).quantize(CENTIME, ROUND_HALF_UP)\n\n\nclass FraisPremium:\n    def calculer(self, montant: Decimal) -> Decimal:\n        return Decimal(\"0.00\")\n\n\nclass FraisProfessionnel:\n    \"\"\"1 %, avec un minimum de 0,50 €.\"\"\"\n\n    def calculer(self, montant: Decimal) -> Decimal:\n        frais = (montant * Decimal(\"0.01\")).quantize(CENTIME, ROUND_HALF_UP)\n        return max(frais, Decimal(\"0.50\"))\n\n\nSTRATEGIES: dict[str, StrategieFrais] = {\n    \"standard\": FraisStandard(),\n    \"premium\": FraisPremium(),\n    \"pro\": FraisProfessionnel(),\n}\n\n\ndef frais_virement(type_compte: str, montant: Decimal) -> Decimal:\n    return STRATEGIES[type_compte].calculer(montant)\n\n\nfor type_compte in [\"standard\", \"premium\", \"pro\"]:\n    print(type_compte, frais_virement(type_compte, Decimal(\"30.00\")))\n",
          "executable": true,
          "sortie_attendue": "standard 0.60\npremium 0.00\npro 0.50\n"
        },
        {
          "type": "texte",
          "markdown": "`quantize(CENTIME, ROUND_HALF_UP)` arrondit au centime, à la façon d'une banque : 0,005 devient 0,01.\n\nAjouter une offre revient maintenant à écrire une classe et une ligne dans le dictionnaire. Les règles existantes ne bougent pas, et chacune se teste seule."
        },
        {
          "type": "texte",